Data,Position,Conference,Conference Type,Receiving Team,Player,From School
QB Grant Gunnell (from North Texas),QB,Conference USA,Non Power 5,Sam Houston,Grant Gunnell,North Texas
RB John Gentry (from Utah State),RB,Conference USA,Non Power 5,Sam Houston,John Gentry,Utah State
OL Rhett Larson (from SMU),OL,Conference USA,Non Power 5,Sam Houston,Rhett Larson,SMU
DL Jaden Phillips (from New Mexico),DL,Conference USA,Non Power 5,Sam Houston,Jaden Phillips,New Mexico
DL Akeem Smith (from Georgia State),DL,Conference USA,Non Power 5,Sam Houston,Akeem Smith,Georgia State
DL Seth Mason (from ULM),DL,Conference USA,Non Power 5,Sam Houston,Seth Mason,ULM
LB Issiah Nixon (from Texas State),LB,Conference USA,Non Power 5,Sam Houston,Issiah Nixon,Texas State
QB Landry Lyddy (from Louisiana Tech),QB,Conference USA,Non Power 5,UAB,Landry Lyddy,Louisiana Tech
RB Demetrius Battle (from West Alabama),RB,Conference USA,Non Power 5,UAB,Demetrius Battle,West Alabama
WR Malachi Holt-Bennett (from Indiana),WR,Conference USA,Non Power 5,UAB,Malachi Holt-Bennett,Indiana
WR Brandon Buckhaulter (from Ole Miss),WR,Conference USA,Non Power 5,UAB,Brandon Buckhaulter,Ole Miss
WR Dazalin Worsham (from Auburn),WR,Conference USA,Non Power 5,UAB,Dazalin Worsham,Auburn
WR Ryan Peppins (from Grambling),WR,Conference USA,Non Power 5,UAB,Ryan Peppins,Grambling
OL William Parker (from Tennessee),OL,Conference USA,Non Power 5,UAB,William Parker,Tennessee
OL Brennan Moran (from Sioux Falls),OL,Conference USA,Non Power 5,UAB,Brennan Moran,Sioux Falls
OL/DL Antavious Woody (from Florida State),OL,Conference USA,Non Power 5,UAB,DL Antavious Woody,Florida State
DL Andrew Ogletree (from Alabama State),DL,Conference USA,Non Power 5,UAB,Andrew Ogletree,Alabama State
LB James Smyre (from Marshall),LB,Conference USA,Non Power 5,UAB,James Smyre,Marshall
LB Desmond Little (from LSU),LB,Conference USA,Non Power 5,UAB,Desmond Little,LSU
DB A.D. Diamond (from Auburn),DB,Conference USA,Non Power 5,UAB,A.D. Diamond,Auburn
DB Brian Mayes (from Incarnate Word),DB,Conference USA,Non Power 5,UAB,Brian Mayes,Incarnate Word
P Patrick Foley (from Arkansas),P ,Conference USA,Non Power 5,UAB,atrick Foley,Arkansas
QB/ATH Kheagian Heckman (from New Mexico State),QB,Conference USA,Non Power 5,UTEP,ATH Kheagian Heckman,New Mexico State
RB Daryon Triche (from Sam Houston),RB,Conference USA,Non Power 5,UTEP,Daryon Triche,Sam Houston
RB Aaron Dumas (from New Mexico),RB,Conference USA,Non Power 5,UTEP,Aaron Dumas,New Mexico
WR Dre Spriggs (from UTSA),WR,Conference USA,Non Power 5,UTEP,Dre Spriggs,UTSA
DB A.J. Odums (from New Mexico),DB,Conference USA,Non Power 5,UTEP,A.J. Odums,New Mexico
QB Owen McCown (from Colorado),QB,Conference USA,Non Power 5,UTSA,Owen McCown,Colorado
RB Rocko Griffin (from Vanderbilt),RB,Conference USA,Non Power 5,UTSA,Rocko Griffin,Vanderbilt
OL Jackson Anderson (from Colorado),OL,Conference USA,Non Power 5,UTSA,Jackson Anderson,Colorado
DL Elliott Davison (from Incarnate Word),DL,Conference USA,Non Power 5,UTSA,Elliott Davison,Incarnate Word
LB Daron Allman (from Angelo State),LB,Conference USA,Non Power 5,UTSA,Daron Allman,Angelo State
DB Kameryn Alexander (from Sam Houston),DB,Conference USA,Non Power 5,UTSA,Kameryn Alexander,Sam Houston
DB Syrus Dumas (from New Mexico State),DB,Conference USA,Non Power 5,UTSA,Syrus Dumas,New Mexico State
QB Bronson Barron (from Weber State),QB,Conference USA,Non Power 5,Western Kentucky,Bronson Barron,Weber State
RB Elijah Young (from Missouri),RB,Conference USA,Non Power 5,Western Kentucky,Elijah Young,Missouri
WR Daniel Edwards (from Illinois),WR,Conference USA,Non Power 5,Western Kentucky,Daniel Edwards,Illinois
WR Ze'Vian Capers (from Auburn),WR,Conference USA,Non Power 5,Western Kentucky,Ze'Vian Capers,Auburn
WR Jimmy Holiday (from Tennessee),WR,Conference USA,Non Power 5,Western Kentucky,Jimmy Holiday,Tennessee
WR Blue Smith (from Cincinnati),WR,Conference USA,Non Power 5,Western Kentucky,Blue Smith,Cincinnati
TE Trevor Borland (from Buffalo),TE,Conference USA,Non Power 5,Western Kentucky,Trevor Borland,Buffalo
OL Mike Moment (from Alcorn State),OL,Conference USA,Non Power 5,Western Kentucky,Mike Moment,Alcorn State
OL Mason Williams (from Harvard),OL,Conference USA,Non Power 5,Western Kentucky,Mason Williams,Harvard
DL Kenyonte Davis (from UT Martin),DL,Conference USA,Non Power 5,Western Kentucky,Kenyonte Davis,UT Martin
DL Marquis Black (from Nebraska),DL,Conference USA,Non Power 5,Western Kentucky,Marquis Black,Nebraska
DL Ryan Williams (from Colorado),DL,Conference USA,Non Power 5,Western Kentucky,Ryan Williams,Colorado
DL Tyrese Black (from ULM),DL,Conference USA,Non Power 5,Western Kentucky,Tyrese Black,ULM
DL Dallas Walker IV (from Texas A&M),DL,Conference USA,Non Power 5,Western Kentucky,Dallas Walker IV,Texas A&M
DL Jayden Loving (from Bethune-Cookman),DL,Conference USA,Non Power 5,Western Kentucky,Jayden Loving,Bethune-Cookman
DL/LB Sebastian Benjamin (from St. Francis Pa.),DL,Conference USA,Non Power 5,Western Kentucky,LB Sebastian Benjamin,St. Francis Pa.
LB Devon Lynch (from Shepherd),LB,Conference USA,Non Power 5,Western Kentucky,Devon Lynch,Shepherd
DB Josh Shodipo (from Northern Michigan),DB,Conference USA,Non Power 5,Western Kentucky,Josh Shodipo,Northern Michigan
DB Anthony Johnson (from West Florida),DB,Conference USA,Non Power 5,Western Kentucky,Anthony Johnson,West Florida
QB Tahj Bullock (from Virginia Tech),QB,MAC,Non Power 5,Akron,Tahj Bullock,Virginia Tech
RB Lorenzo Lingard (from Florida),RB,MAC,Non Power 5,Akron,Lorenzo Lingard,Florida
RB Drake Anderson (from Arizona),RB,MAC,Non Power 5,Akron,Drake Anderson,Arizona
WR Dakota Thomas (from Western Kentucky),WR,MAC,Non Power 5,Akron,Dakota Thomas,Western Kentucky
TE Jacob Newell (from Arizona State),TE,MAC,Non Power 5,Akron,Jacob Newell,Arizona State
OL Ben Frank (from Hobart),OL,MAC,Non Power 5,Akron,Ben Frank,Hobart
OL AJ George (from Cincinnati),OL,MAC,Non Power 5,Akron,AJ George,Cincinnati
OL Joshua Blanchard (from USF),OL,MAC,Non Power 5,Akron,Joshua Blanchard,USF
OL Keon Kindred (from Maryland),OL,MAC,Non Power 5,Akron,Keon Kindred,Maryland
DL Terray Jones (from Tennessee State),DL,MAC,Non Power 5,Akron,Terray Jones,Tennessee State
DL Lama Lavea (from New Mexico State),DL,MAC,Non Power 5,Akron,Lama Lavea,New Mexico State
DL Ahmad Rabah (from American International College),DL,MAC,Non Power 5,Akron,Ahmad Rabah,American International College
LB Shammond Cooper (from Illinois),LB,MAC,Non Power 5,Akron,Shammond Cooper,Illinois
LB Ridge Howard (from Northern Illinois),LB,MAC,Non Power 5,Akron,Ridge Howard,Northern Illinois
DB Joey Hunter (from South Carolina),DB,MAC,Non Power 5,Akron,Joey Hunter,South Carolina
DB Judson Tallandier (from Pitt),DB,MAC,Non Power 5,Akron,Judson Tallandier,Pitt
S Terence Thomas (from Purdue),S ,MAC,Non Power 5,Akron,erence Thomas,Purdue
QB Layne Hatcher (from Texas State),QB,MAC,Non Power 5,Ball State,Layne Hatcher,Texas State
RB Marquez Cooper (from Kent State),RB,MAC,Non Power 5,Ball State,Marquez Cooper,Kent State
RB Charlie Spegal (from Indiana),RB,MAC,Non Power 5,Ball State,Charlie Spegal,Indiana
WR Ty Robinson (from Colorado),WR,MAC,Non Power 5,Ball State,Ty Robinson,Colorado
WR Zavier Simpson (from Wake Forest),WR,MAC,Non Power 5,Ball State,Zavier Simpson,Wake Forest
WR Ahmad Edwards (from Jacksonville State),WR,MAC,Non Power 5,Ball State,Ahmad Edwards,Jacksonville State
"TE Jeffrey Simmons (from Miami, Ohio)",TE,MAC,Non Power 5,Ball State,Jeffrey Simmons,"Miami, Ohio"
OL Luke Wiginton (from Indiana),OL,MAC,Non Power 5,Ball State,Luke Wiginton,Indiana
OL Jon Mucciolo (from Sacred Heart),OL,MAC,Non Power 5,Ball State,Jon Mucciolo,Sacred Heart
DL Mikhari Sibblis (from Lehigh),DL,MAC,Non Power 5,Ball State,Mikhari Sibblis,Lehigh
DL James Makszin (from Rhode Island),DL,MAC,Non Power 5,Ball State,James Makszin,Rhode Island
DB Aljareek Malry (from VMI),DB,MAC,Non Power 5,Ball State,Aljareek Malry,VMI
DB Jahmad Harmon (from Kent State),DB,MAC,Non Power 5,Ball State,Jahmad Harmon,Kent State
DB D.D. Snyder (from Illinois),DB,MAC,Non Power 5,Ball State,D.D. Snyder,Illinois
DB Damion Charity (from Old Dominion),DB,MAC,Non Power 5,Ball State,Damion Charity,Old Dominion
LS Tucker Dumn (from Colgate),LS,MAC,Non Power 5,Ball State,Tucker Dumn,Colgate
QB Connor Bazelak (from Indiana),QB,MAC,Non Power 5,Bowling Green,Connor Bazelak,Indiana
QB Daelen Menard (from Boston College),QB,MAC,Non Power 5,Bowling Green,Daelen Menard,Boston College
QB Hayden Timosciek (from Purdue),QB,MAC,Non Power 5,Bowling Green,Hayden Timosciek,Purdue
WR Dominic Grguric (from Valparaiso),WR,MAC,Non Power 5,Bowling Green,Dominic Grguric,Valparaiso
WR Abdul Ibrahim (from Alabama A&M),WR,MAC,Non Power 5,Bowling Green,Abdul Ibrahim,Alabama A&M
WR Jaylon Tillman (from Grand Valley State),WR,MAC,Non Power 5,Bowling Green,Jaylon Tillman,Grand Valley State
WR Finn Hogan (from Central Michigan),WR,MAC,Non Power 5,Bowling Green,Finn Hogan,Central Michigan
OL Armon Bethea (from Arizona State),OL,MAC,Non Power 5,Bowling Green,Armon Bethea,Arizona State
OL Hunter Deyo (from Iowa State),OL,MAC,Non Power 5,Bowling Green,Hunter Deyo,Iowa State
OL Chris Akporoghene (from Tulsa),OL,MAC,Non Power 5,Bowling Green,Chris Akporoghene,Tulsa
DL Chace Davis (from UTSA),DL,MAC,Non Power 5,Bowling Green,Chace Davis,UTSA
DL Evan Branch-Hayes (from Arizona),DL,MAC,Non Power 5,Bowling Green,Evan Branch-Hayes,Arizona
LB Davian Mayo (from Memphis),LB,MAC,Non Power 5,Bowling Green,Davian Mayo,Memphis
LB Andrew Booker (from Maryland),LB,MAC,Non Power 5,Bowling Green,Andrew Booker,Maryland
DB Steve Lubischer (from Boston College),DB,MAC,Non Power 5,Bowling Green,Steve Lubischer,Boston College
DB Jordan Jackson (from Stony Brook),DB,MAC,Non Power 5,Bowling Green,Jordan Jackson,Stony Brook
QB CJ Ogbonna (from Southeast Missouri State),QB,MAC,Non Power 5,Buffalo,CJ Ogbonna,Southeast Missouri State
WR Darrell Harding Jr. (from Duke),WR,MAC,Non Power 5,Buffalo,Darrell Harding Jr.,Duke
WR Chance Morrow (from Louisville),WR,MAC,Non Power 5,Buffalo,Chance Morrow,Louisville
WR Victor Snow (from Nevada),WR,MAC,Non Power 5,Buffalo,Victor Snow,Nevada
TE Zion Carter (from Dartmouth),TE,MAC,Non Power 5,Buffalo,Zion Carter,Dartmouth
TE Jake Orlando (from UMass),TE,MAC,Non Power 5,Buffalo,Jake Orlando,UMass
OL Alex Heininger (from Central Michigan),OL,MAC,Non Power 5,Buffalo,Alex Heininger,Central Michigan
OL James Carrington III (from Allegheny College),OL,MAC,Non Power 5,Buffalo,James Carrington III,Allegheny College
OL Nick Beans (from Notre Dame College),OL,MAC,Non Power 5,Buffalo,Nick Beans,Notre Dame College
DL Jyaire Stevens (from Lafayette),DL,MAC,Non Power 5,Buffalo,Jyaire Stevens,Lafayette
LB Joe Andreessen (from Bryant),LB,MAC,Non Power 5,Buffalo,Joe Andreessen,Bryant
DB Dre Greeley (from Colorado State),DB,MAC,Non Power 5,Buffalo,Dre Greeley,Colorado State
DB Amonte Strothers (from Delaware),DB,MAC,Non Power 5,Buffalo,Amonte Strothers,Delaware
DB Marquis Cooper (from Colgate),DB,MAC,Non Power 5,Buffalo,Marquis Cooper,Colgate
DB Demetrius Harris (from Cornell),DB,MAC,Non Power 5,Buffalo,Demetrius Harris,Cornell
DB James Ziglor III (from Vanderbilt),DB,MAC,Non Power 5,Buffalo,James Ziglor III,Vanderbilt
RB B.J. Harris (from Missouri),RB,MAC,Non Power 5,Central Michigan,B.J. Harris,Missouri
WR Stephan Bracey (from Wisconsin),WR,MAC,Non Power 5,Central Michigan,Stephan Bracey,Wisconsin
WR Thomas Pannunzio (from Colorado State),WR,MAC,Non Power 5,Central Michigan,Thomas Pannunzio,Colorado State
OL Dominic Serapiglia (from Southeastern Louisiana),OL,MAC,Non Power 5,Central Michigan,Dominic Serapiglia,Southeastern Louisiana
DL Maurice White (from Memphis),DL,MAC,Non Power 5,Central Michigan,Maurice White,Memphis
K Tristan Mattson (from Arkansas State),K ,MAC,Non Power 5,Central Michigan,Tristan Mattson,Arkansas State
P Jake Walrath (from Tarleton State),P ,MAC,Non Power 5,Central Michigan,ake Walrath,Tarleton State
RB Dontae McMillan (from Weber State),RB,MAC,Non Power 5,Eastern Michigan,Dontae McMillan,Weber State
WR Terry Lockett (from Michigan State),WR,MAC,Non Power 5,Eastern Michigan,Terry Lockett,Michigan State
WR Javon Swinton (from Indiana),WR,MAC,Non Power 5,Eastern Michigan,Javon Swinton,Indiana
OL Chris Mayo (from West Virginia),OL,MAC,Non Power 5,Eastern Michigan,Chris Mayo,West Virginia
OL Dan Sunderman (from Central Missouri),OL,MAC,Non Power 5,Eastern Michigan,Dan Sunderman,Central Missouri
OL Owen Snively (from Colorado State),OL,MAC,Non Power 5,Eastern Michigan,Owen Snively,Colorado State
K Kenyon Bowyer (from Marshall),K ,MAC,Non Power 5,Eastern Michigan,Kenyon Bowyer,Marshall
QB Jaren Lewis (from Kansas State),QB,MAC,Non Power 5,Kent State,Jaren Lewis,Kansas State
QB Michael Alaimo (from Purdue),QB,MAC,Non Power 5,Kent State,Michael Alaimo,Purdue
RB Ky Thomas (from Kansas),RB,MAC,Non Power 5,Kent State,Ky Thomas,Kansas
RB Jaylen Thomas (from Colorado State),RB,MAC,Non Power 5,Kent State,Jaylen Thomas,Colorado State
WR Ali Fisher (from Buffalo),WR,MAC,Non Power 5,Kent State,Ali Fisher,Buffalo
WR Xavier Williams (from Utah State),WR,MAC,Non Power 5,Kent State,Xavier Williams,Utah State
WR Isaiah Batton (from Fresno State),WR,MAC,Non Power 5,Kent State,Isaiah Batton,Fresno State
WR Jack Coulson (from Holy Cross),WR,MAC,Non Power 5,Kent State,Jack Coulson,Holy Cross
OL Tristan Bittner (from Marshall),OL,MAC,Non Power 5,Kent State,Tristan Bittner,Marshall
OL Kevin Toth (from Rutgers),OL,MAC,Non Power 5,Kent State,Kevin Toth,Rutgers
OL Jimto Obidegwu (from Temple),OL,MAC,Non Power 5,Kent State,Jimto Obidegwu,Temple
DL Eric Weaver (from VMI),DL,MAC,Non Power 5,Kent State,Eric Weaver,VMI
DL Javier Duran (from Tarleton State),DL,MAC,Non Power 5,Kent State,Javier Duran,Tarleton State
DL Mattheus Carroll (from Virginia Tech),DL,MAC,Non Power 5,Kent State,Mattheus Carroll,Virginia Tech
DL Marcus Winfield (from Delaware State),DL,MAC,Non Power 5,Kent State,Marcus Winfield,Delaware State
DL Mason Maddox (from Colorado),DL,MAC,Non Power 5,Kent State,Mason Maddox,Colorado
DL Tyler Baylor (from Maryland),DL,MAC,Non Power 5,Kent State,Tyler Baylor,Maryland
LB Nick Giacolone (from New Mexico State),LB,MAC,Non Power 5,Kent State,Nick Giacolone,New Mexico State
LB Devin Nicholson (from Missouri),LB,MAC,Non Power 5,Kent State,Devin Nicholson,Missouri
DB Naim Muhammad (from West Virginia),DB,MAC,Non Power 5,Kent State,Naim Muhammad,West Virginia
DB Dallas Craddieth (from Iowa),DB,MAC,Non Power 5,Kent State,Dallas Craddieth,Iowa
DB Lem Watley-Neely (from Indiana),DB,MAC,Non Power 5,Kent State,Lem Watley-Neely,Indiana
DB Xavier Cokley (from James Madison),DB,MAC,Non Power 5,Kent State,Xavier Cokley,James Madison
DB Jalani Williams (from Missouri),DB,MAC,Non Power 5,Kent State,Jalani Williams,Missouri
Miami (Ohio),Mi,MAC,Non Power 5,Miami (Ohio),mi,#VALUE!
QB Maddox Kopp (from Colorado) waiver was denied for 2023,QB,MAC,Non Power 5,Miami (Ohio),Maddox Kopp,Colorado
RB Rashad Amos (from South Carolina),RB,MAC,Non Power 5,Miami (Ohio),Rashad Amos,South Carolina
WR Joe Wilkins Jr. (from Notre Dame),WR,MAC,Non Power 5,Miami (Ohio),Joe Wilkins Jr.,Notre Dame
WR Cade McDonald (from Michigan State),WR,MAC,Non Power 5,Miami (Ohio),Cade McDonald,Michigan State
WR Gage Larvadain (from Southeastern Louisiana),WR,MAC,Non Power 5,Miami (Ohio),Gage Larvadain,Southeastern Louisiana
OL John Young (from Kentucky),OL,MAC,Non Power 5,Miami (Ohio),John Young,Kentucky
LB Jackson Kuwatch (from Ohio State),LB,MAC,Non Power 5,Miami (Ohio),Jackson Kuwatch,Ohio State
DB Will Hardrick (from Mississippi State),DB,MAC,Non Power 5,Miami (Ohio),Will Hardrick,Mississippi State
DB Jayden Williams (from USC),DB,MAC,Non Power 5,Miami (Ohio),Jayden Williams,USC
DB Jeremiah Caldwell (from Louisville),DB,MAC,Non Power 5,Miami (Ohio),Jeremiah Caldwell,Louisville
QB C.J. Jordan (from Idaho),QB,MAC,Non Power 5,Northern Illinois,C.J. Jordan,Idaho
RB Gavin Williams (from Iowa),RB,MAC,Non Power 5,Northern Illinois,Gavin Williams,Iowa
RB Kendrell Flowers (from South Carolina State),RB,MAC,Non Power 5,Northern Illinois,Kendrell Flowers,South Carolina State
WR Davis Patterson (from Notre Dame College),WR,MAC,Non Power 5,Northern Illinois,Davis Patterson,Notre Dame College
LB Tyler Jackson (from Lamar),LB,MAC,Non Power 5,Northern Illinois,Tyler Jackson,Lamar
LB Keshon Artis (from Virginia Tech),LB,MAC,Non Power 5,Northern Illinois,Keshon Artis,Virginia Tech
DB Gabriel Amegatcher (from Nebraska-Kearney),DB,MAC,Non Power 5,Northern Illinois,Gabriel Amegatcher,Nebraska-Kearney
DB Shad Dabney (from Kansas),DB,MAC,Non Power 5,Northern Illinois,Shad Dabney,Kansas
K Jake Seibert (from Ohio State),K ,MAC,Non Power 5,Northern Illinois,Jake Seibert,Ohio State
WR Jack Kenneally (from Youngstown State),WR,MAC,Non Power 5,Ohio,Jack Kenneally,Youngstown State
WR Christian Hilton (from The Citadel),WR,MAC,Non Power 5,Ohio,Christian Hilton,The Citadel
OL Ches Jackson (from Colorado State),OL,MAC,Non Power 5,Ohio,Ches Jackson,Colorado State
OL Dane Jackson (from North Texas),OL,MAC,Non Power 5,Ohio,Dane Jackson,North Texas
DL Kwame Sutton (from Austin Peay),DL,MAC,Non Power 5,Ohio,Kwame Sutton,Austin Peay
LB Kaci Seegars (from Liberty),LB,MAC,Non Power 5,Ohio,Kaci Seegars,Liberty
LB Tristan Cox (from Purdue),LB,MAC,Non Power 5,Ohio,Tristan Cox,Purdue
DB Walter Reynolds (from Holy Cross),DB,MAC,Non Power 5,Ohio,Walter Reynolds,Holy Cross
DB Miles Fleming (from Minnesota),DB,MAC,Non Power 5,Ohio,Miles Fleming,Minnesota
WR Shawn Munnerlyn (from Rutgers),WR,MAC,Non Power 5,Toledo,Shawn Munnerlyn,Rutgers
WR Jaden Dottin (from Penn State),WR,MAC,Non Power 5,Toledo,Jaden Dottin,Penn State
OL David Nwaogwugwu (from Rutgers),OL,MAC,Non Power 5,Toledo,David Nwaogwugwu,Rutgers
OL Rod Orr (from Florida State),OL,MAC,Non Power 5,Toledo,Rod Orr,Florida State
OL Jackson Cannon (from Mississippi State),OL,MAC,Non Power 5,Toledo,Jackson Cannon,Mississippi State
DL Travion Ford (from Missouri),DL,MAC,Non Power 5,Toledo,Travion Ford,Missouri
QB Hayden Wolff (from Old Dominion),QB,MAC,Non Power 5,Western Michigan,Hayden Wolff,Old Dominion
RB Keshawn King (from Virginia Tech),RB,MAC,Non Power 5,Western Michigan,Keshawn King,Virginia Tech
WR Leroy Thomas (from VMI),WR,MAC,Non Power 5,Western Michigan,Leroy Thomas,VMI
WR Kenneth Womack (from Sacred Heart),WR,MAC,Non Power 5,Western Michigan,Kenneth Womack,Sacred Heart
OL Chad Schuster (from Syracuse),OL,MAC,Non Power 5,Western Michigan,Chad Schuster,Syracuse
OL Tedi Kushi (from LIU),OL,MAC,Non Power 5,Western Michigan,Tedi Kushi,LIU
OL Michael Shanahan (from Texas Tech),OL,MAC,Non Power 5,Western Michigan,Michael Shanahan,Texas Tech
LB Donald Willis (from Minnesota),LB,MAC,Non Power 5,Western Michigan,Donald Willis,Minnesota
LB Jacob Wahlberg (from Purdue),LB,MAC,Non Power 5,Western Michigan,Jacob Wahlberg,Purdue
DB Tate Hallock (from Michigan State),DB,MAC,Non Power 5,Western Michigan,Tate Hallock,Michigan State
DB Bilhal Kone (from Indiana State),DB,MAC,Non Power 5,Western Michigan,Bilhal Kone,Indiana State
WR Chase Penry (from Colorado),WR,Mountain West,Non Power 5,Boise State,Chase Penry,Colorado
OL Nikolai Bujnowski (from Virginia Tech),OL,Mountain West,Non Power 5,Boise State,Nikolai Bujnowski,Virginia Tech
OL Ethan Carde (from Texas Tech),OL,Mountain West,Non Power 5,Boise State,Ethan Carde,Texas Tech
OL Tyler Keinath (from Western Illinois),OL,Mountain West,Non Power 5,Boise State,Tyler Keinath,Western Illinois
DL Kivon Wright (from Boston College),DL,Mountain West,Non Power 5,Boise State,Kivon Wright,Boston College
DL Tyler Wegis (from Utah),DL,Mountain West,Non Power 5,Boise State,Tyler Wegis,Utah
DL Howard Brown (from Iowa State),DL,Mountain West,Non Power 5,Boise State,Howard Brown,Iowa State
DL Sheldon Newton (from Northern Arizona),DL,Mountain West,Non Power 5,Boise State,Sheldon Newton,Northern Arizona
DB Titus Toler (from Wisconsin),DB,Mountain West,Non Power 5,Boise State,Titus Toler,Wisconsin
RB Kobe Johnson (from North Dakota State),RB,Mountain West,Non Power 5,Colorado State,Kobe Johnson,North Dakota State
WR Keyonta Lanier (from New Mexico),WR,Mountain West,Non Power 5,Colorado State,Keyonta Lanier,New Mexico
WR Dylan Goffney (from SMU),WR,Mountain West,Non Power 5,Colorado State,Dylan Goffney,SMU
TE Dallin Holker (from BYU),TE,Mountain West,Non Power 5,Colorado State,Dallin Holker,BYU
OL Drew Moss (from Lamar),OL,Mountain West,Non Power 5,Colorado State,Drew Moss,Lamar
OL Andrew Cannon (from Nevada),OL,Mountain West,Non Power 5,Colorado State,Andrew Cannon,Nevada
OL Saveyon Henderson (from Lane College),OL,Mountain West,Non Power 5,Colorado State,Saveyon Henderson,Lane College
OL Bobby Lawrence (from Missouri),OL,Mountain West,Non Power 5,Colorado State,Bobby Lawrence,Missouri
OL Oliver Jervis (from Monmouth),OL,Mountain West,Non Power 5,Colorado State,Oliver Jervis,Monmouth
DL Matt Thomas (from Rutgers),DL,Mountain West,Non Power 5,Colorado State,Matt Thomas,Rutgers
DL Tony Pierce (from North Dakota State),DL,Mountain West,Non Power 5,Colorado State,Tony Pierce,North Dakota State
LB Trey Paster (from California),LB,Mountain West,Non Power 5,Colorado State,Trey Paster,California
DB Dominic Morris (from Furman),DB,Mountain West,Non Power 5,Colorado State,Dominic Morris,Furman
DB Tyrell Grayson (from Utah Tech),DB,Mountain West,Non Power 5,Colorado State,Tyrell Grayson,Utah Tech
DB Dom Jones (from North Dakota State),DB,Mountain West,Non Power 5,Colorado State,Dom Jones,North Dakota State
DB Ron Hardge (from Oregon State),DB,Mountain West,Non Power 5,Colorado State,Ron Hardge,Oregon State
K Ashton Wolff (from Central Washington),K ,Mountain West,Non Power 5,Colorado State,Ashton Wolff,Central Washington
K Jordan Noyes (from Utah),K ,Mountain West,Non Power 5,Colorado State,Jordan Noyes,Utah
QB Mikey Keene (from UCF),QB,Mountain West,Non Power 5,Fresno State,Mikey Keene,UCF
RB Damien Moore (from California),RB,Mountain West,Non Power 5,Fresno State,Damien Moore,California
WR Jaelen Gill (from Boston College),WR,Mountain West,Non Power 5,Fresno State,Jaelen Gill,Boston College
WR Mikel Barkley (from Toledo),WR,Mountain West,Non Power 5,Fresno State,Mikel Barkley,Toledo
OL Campbell McHarg (from Oregon State),OL,Mountain West,Non Power 5,Fresno State,Campbell McHarg,Oregon State
OL Kingsley Ugwu (from Kansas State),OL,Mountain West,Non Power 5,Fresno State,Kingsley Ugwu,Kansas State
DL Kemari Munier-Bailey (from Idaho),DL,Mountain West,Non Power 5,Fresno State,Kemari Munier-Bailey,Idaho
LB Tuasivi Nomura (from USC),LB,Mountain West,Non Power 5,Fresno State,Tuasivi Nomura,USC
LB/LS Steven Scheidt (from Eastern Michigan),LB,Mountain West,Non Power 5,Fresno State,LS Steven Scheidt,Eastern Michigan
DB Dean Clark (from Kent State),DB,Mountain West,Non Power 5,Fresno State,Dean Clark,Kent State
K Jordan Kennedy (from Mississippi State),K ,Mountain West,Non Power 5,Fresno State,Jordan Kennedy,Mississippi State
P Nick Verdugo (from Old Dominion),P ,Mountain West,Non Power 5,Fresno State,ick Verdugo,Old Dominion
QB Jonah Chong (from Nevada),QB,Mountain West,Non Power 5,Hawaii,Jonah Chong,Nevada
WR Steven McBride (from Kansas),WR,Mountain West,Non Power 5,Hawaii,Steven McBride,Kansas
OL Joshua Atkins (from Houston),OL,Mountain West,Non Power 5,Hawaii,Joshua Atkins,Houston
DL Elijah Robinson (from East Carolina),DL,Mountain West,Non Power 5,Hawaii,Elijah Robinson,East Carolina
DL Kuao Peihopa (from Washington),DL,Mountain West,Non Power 5,Hawaii,Kuao Peihopa,Washington
DL Josh Jerome (from Eastern Washington),DL,Mountain West,Non Power 5,Hawaii,Josh Jerome,Eastern Washington
LB Patrick Hisatake (from California),LB,Mountain West,Non Power 5,Hawaii,Patrick Hisatake,California
CB Cam Stone (from Wyoming),CB,Mountain West,Non Power 5,Hawaii,Cam Stone,Wyoming
DB Kilinahe Mendiola-Jensen (from UNLV),DB,Mountain West,Non Power 5,Hawaii,Kilinahe Mendiola-Jensen,UNLV
DB Justin Prince (from UTEP),DB,Mountain West,Non Power 5,Hawaii,Justin Prince,UTEP
S Oakie Salave'a (from Colorado),S ,Mountain West,Non Power 5,Hawaii,akie Salave'a,Colorado
QB Brendon Lewis (from Colorado),QB,Mountain West,Non Power 5,Nevada,Brendon Lewis,Colorado
RB Sean Dollars (from Oregon),RB,Mountain West,Non Power 5,Nevada,Sean Dollars,Oregon
RB Ashton Hayes (from California),RB,Mountain West,Non Power 5,Nevada,Ashton Hayes,California
RB Peyton Dixon (from New Mexico),RB,Mountain West,Non Power 5,Nevada,Peyton Dixon,New Mexico
WR Gerick Robinson (from Colorado State),WR,Mountain West,Non Power 5,Nevada,Gerick Robinson,Colorado State
WR John Jackson (from USC),WR,Mountain West,Non Power 5,Nevada,John Jackson,USC
WR Isaah Crocker (from Oregon),WR,Mountain West,Non Power 5,Nevada,Isaah Crocker,Oregon
TE Keleki Latu (from California),TE,Mountain West,Non Power 5,Nevada,Keleki Latu,California
TE Elijah Mojarro (from California),TE,Mountain West,Non Power 5,Nevada,Elijah Mojarro,California
OL Jason Rodriguez (from USC),OL,Mountain West,Non Power 5,Nevada,Jason Rodriguez,USC
OL Josh Castro (from Cal Lutheran),OL,Mountain West,Non Power 5,Nevada,Josh Castro,Cal Lutheran
DL Tanner Vaughan (University of Mary),DL,Mountain West,Non Power 5,Nevada,Tanner Vaughan,rsity of Mary
DL Mackavelli Laie Malotumau (from Utah Tech),DL,Mountain West,Non Power 5,Nevada,Mackavelli Laie Malotumau,Utah Tech
DL Henry Ikahihifo (from California),DL,Mountain West,Non Power 5,Nevada,Henry Ikahihifo,California
LB Jackson LaDuke (from Oregon),LB,Mountain West,Non Power 5,Nevada,Jackson LaDuke,Oregon
LB Kaleo Neves (from Utah State),LB,Mountain West,Non Power 5,Nevada,Kaleo Neves,Utah State
LB Malcolm McClure (from California),LB,Mountain West,Non Power 5,Nevada,Malcolm McClure,California
LB Adrian Jackson (from Oregon),LB,Mountain West,Non Power 5,Nevada,Adrian Jackson,Oregon
DB Tre Weed (from Eastern Washington),DB,Mountain West,Non Power 5,Nevada,Tre Weed,Eastern Washington
DB Caine Savage (from Utah),DB,Mountain West,Non Power 5,Nevada,Caine Savage,Utah
