Data,Position,Conference,Conference Type,Receiving Team,Player,From School
LB Oluwafemi Oladejo (from California),LB,Pac-12,Power 5,UCLA,Oluwafemi Oladejo,California
DB Jordan Anderson (from Bowling Green),DB,Pac-12,Power 5,UCLA,Jordan Anderson,Bowling Green
K Blake Glessner (from Montana State),K ,Pac-12,Power 5,UCLA,Blake Glessner,Montana State
P Will Powers (from Princeton),P ,Pac-12,Power 5,UCLA,ill Powers,Princeton
RB MarShawn Lloyd (from South Carolina),RB,Pac-12,Power 5,USC,MarShawn Lloyd,South Carolina
WR Dorian Singer (from Arizona),WR,Pac-12,Power 5,USC,Dorian Singer,Arizona
OL Michael Tarquin (from Florida),OL,Pac-12,Power 5,USC,Michael Tarquin,Florida
OL Emmanuel Pregnon (from Wyoming),OL,Pac-12,Power 5,USC,Emmanuel Pregnon,Wyoming
OL Jarrett Kingston (from Washington State),OL,Pac-12,Power 5,USC,Jarrett Kingston,Washington State
DL Kyon Barrs (from Arizona),DL,Pac-12,Power 5,USC,Kyon Barrs,Arizona
DL Anthony Lucas (from Texas A&M),DL,Pac-12,Power 5,USC,Anthony Lucas,Texas A&M
DL Bear Alexander (from Georgia),DL,Pac-12,Power 5,USC,Bear Alexander,Georgia
DL Jack Sullivan (from Purdue),DL,Pac-12,Power 5,USC,Jack Sullivan,Purdue
LB Jamil Muhammad (from Georgia State),LB,Pac-12,Power 5,USC,Jamil Muhammad,Georgia State
LB Mason Cobb (from Oklahoma State),LB,Pac-12,Power 5,USC,Mason Cobb,Oklahoma State
CB Christian Roland-Wallace (from Arizona),CB,Pac-12,Power 5,USC,Christian Roland-Wallace,Arizona
DB Tre'Quon Fegans (from Alabama),DB,Pac-12,Power 5,USC,Tre'Quon Fegans,Alabama
P Eddie Czaplicki (from Arizona State),P ,Pac-12,Power 5,USC,ddie Czaplicki,Arizona State
WR Emery Simmons (from Indiana),WR,Pac-12,Power 5,Utah,Emery Simmons,Indiana
WR Mycah Pittman (from Florida State),WR,Pac-12,Power 5,Utah,Mycah Pittman,Florida State
TE Landen King (from Auburn),TE,Pac-12,Power 5,Utah,Landen King,Auburn
DL Logan Fano (from BYU),DL,Pac-12,Power 5,Utah,Logan Fano,BYU
LB Levani Damuni (from Stanford),LB,Pac-12,Power 5,Utah,Levani Damuni,Stanford
DB Miles Battle (from Ole Miss),DB,Pac-12,Power 5,Utah,Miles Battle,Ole Miss
DB Briton Allen (from USC),DB,Pac-12,Power 5,Utah,Briton Allen,USC
K Cole Becker (from Colorado),K ,Pac-12,Power 5,Utah,Cole Becker,Colorado
RB Daniyel Ngata (from Arizona State),RB,Pac-12,Power 5,Washington,Daniyel Ngata,Arizona State
RB Dillon Johnson (from Mississippi State),RB,Pac-12,Power 5,Washington,Dillon Johnson,Mississippi State
WR Germie Bernard (from Michigan State),WR,Pac-12,Power 5,Washington,Germie Bernard,Michigan State
TE Josh Cuevas (from Cal Poly),TE,Pac-12,Power 5,Washington,Josh Cuevas,Cal Poly
OL Jalen Klemm (from Kansas State),OL,Pac-12,Power 5,Washington,Jalen Klemm,Kansas State
DL Zach Durfree (from University of Sioux Falls),DL,Pac-12,Power 5,Washington,Zach Durfree,University of Sioux Falls
LB Ralen Goforth (from USC),LB,Pac-12,Power 5,Washington,Ralen Goforth,USC
LB Braydon Bruener (from Oregon State),LB,Pac-12,Power 5,Washington,Braydon Bruener,Oregon State
CB Jabbar Muhammad (from Oklahoma State),CB,Pac-12,Power 5,Washington,Jabbar Muhammad,Oklahoma State
DB Darren Barkins (from Oregon),DB,Pac-12,Power 5,Washington,Darren Barkins,Oregon
WR Isaiah Hamilton (from San Jose State),WR,Pac-12,Power 5,Washington State,Isaiah Hamilton,San Jose State
WR Kyle Williams (from UNLV),WR,Pac-12,Power 5,Washington State,Kyle Williams,UNLV
WR Josh Kelly (from Fresno State),WR,Pac-12,Power 5,Washington State,Josh Kelly,Fresno State
OL Christy Nkanu (from Southern Utah),OL,Pac-12,Power 5,Washington State,Christy Nkanu,Southern Utah
DL Na'im Rodman (from Colorado),DL,Pac-12,Power 5,Washington State,Na'im Rodman,Colorado
LB Devin Richardson (from Texas),LB,Pac-12,Power 5,Washington State,Devin Richardson,Texas
LB Ahmad McCullough (from Maryland),LB,Pac-12,Power 5,Washington State,Ahmad McCullough,Maryland
LB Davon Hicks (from USF),LB,Pac-12,Power 5,Washington State,Davon Hicks,USF
DB Dominic Tatum (from Utah State),DB,Pac-12,Power 5,Washington State,Dominic Tatum,Utah State
QB Tyler Buchner (from Notre Dame),QB,SEC,Power 5,Alabama,Tyler Buchner,Notre Dame
TE CJ Dippre (from Maryland),TE,SEC,Power 5,Alabama,CJ Dippre,Maryland
LB Trezmen Marshall (from Georgia),LB,SEC,Power 5,Alabama,Trezmen Marshall,Georgia
DB Trey Amos (from Louisiana),DB,SEC,Power 5,Alabama,Trey Amos,Louisiana
DB Jaylen Key (from UAB),DB,SEC,Power 5,Alabama,Jaylen Key,UAB
QB Jacolby Criswell (from North Carolina),QB,SEC,Power 5,Arkansas,Jacolby Criswell,North Carolina
WR Andrew Armstrong (from Texas A&M-Commerce),WR,SEC,Power 5,Arkansas,Andrew Armstrong,Texas A&M-Commerce
WR Marlon Crockett (from Memphis),WR,SEC,Power 5,Arkansas,Marlon Crockett,Memphis
WR Tyrone Broden (from Bowling Green),WR,SEC,Power 5,Arkansas,Tyrone Broden,Bowling Green
WR Isaac TeSlaa (from Hillsdale College),WR,SEC,Power 5,Arkansas,Isaac TeSlaa,Hillsdale College
TE Var'Keyes Gumms (from North Texas),TE,SEC,Power 5,Arkansas,Var'Keyes Gumms,North Texas
TE Francis Sherman (from Louisville),TE,SEC,Power 5,Arkansas,Francis Sherman,Louisville
OL Josh Braun (from Florida),OL,SEC,Power 5,Arkansas,Josh Braun,Florida
DL John Morgan (from Pitt),DL,SEC,Power 5,Arkansas,John Morgan,Pitt
DL Keivie Rose (from Louisiana Tech),DL,SEC,Power 5,Arkansas,Keivie Rose,Louisiana Tech
DL Anthony Booker (from Maryland),DL,SEC,Power 5,Arkansas,Anthony Booker,Maryland
DL Trajan Jeffcoat (from Missouri),DL,SEC,Power 5,Arkansas,Trajan Jeffcoat,Missouri
LB Antonio Grier (from USF),LB,SEC,Power 5,Arkansas,Antonio Grier,USF
LB Jaheim Thomas (from Cincinnati),LB,SEC,Power 5,Arkansas,Jaheim Thomas,Cincinnati
DB Al Walcott (from Baylor),DB,SEC,Power 5,Arkansas,Al Walcott,Baylor
DB Jaheim Singletary (from Georgia),DB,SEC,Power 5,Arkansas,Jaheim Singletary,Georgia
DB Lorando Johnson (from Baylor),DB,SEC,Power 5,Arkansas,Lorando Johnson,Baylor
DB Kee'yon Stewart (from TCU),DB,SEC,Power 5,Arkansas,Kee'yon Stewart,TCU
P Devin Bale (from Northern Colorado),P ,SEC,Power 5,Arkansas,Devin Bale,Northern Colorado
QB Payton Thorne (from Michigan State),QB,SEC,Power 5,Auburn,Payton Thorne,Michigan State
RB Brian Battie (from USF),RB,SEC,Power 5,Auburn,Brian Battie,USF
WR Nick Mardner (from Cincinnati),WR,SEC,Power 5,Auburn,Nick Mardner,Cincinnati
WR Jyaire Shorter (from North Texas),WR,SEC,Power 5,Auburn,Jyaire Shorter,North Texas
WR Caleb Burton (from Ohio State),WR,SEC,Power 5,Auburn,Caleb Burton,Ohio State
WR Shane Hooks (from Jackson State),WR,SEC,Power 5,Auburn,Shane Hooks,Jackson State
TE Rivaldo Fairweather (from FIU),TE,SEC,Power 5,Auburn,Rivaldo Fairweather,FIU
OL Dillon Wade (from Tulsa),OL,SEC,Power 5,Auburn,Dillon Wade,Tulsa
OL Jaden Muskrat (from Tulsa),OL,SEC,Power 5,Auburn,Jaden Muskrat,Tulsa
OL Avery Jones (from East Carolina),OL,SEC,Power 5,Auburn,Avery Jones,East Carolina
OL Dylan Senda (from Northwestern),OL,SEC,Power 5,Auburn,Dylan Senda,Northwestern
OL Gunner Britton (from Western Kentucky),OL,SEC,Power 5,Auburn,Gunner Britton,Western Kentucky
DL Justin Rogers (from Kentucky),DL,SEC,Power 5,Auburn,Justin Rogers,Kentucky
DL Lawrence Johnson (from Purdue),DL,SEC,Power 5,Auburn,Lawrence Johnson,Purdue
DL Stephen Sings (from Liberty),DL,SEC,Power 5,Auburn,Stephen Sings,Liberty
DL Mosiah Nasili-Kite (from Maryland),DL,SEC,Power 5,Auburn,Mosiah Nasili-Kite,Maryland
DL Elijah McAllister (from Vanderbilt),DL,SEC,Power 5,Auburn,Elijah McAllister,Vanderbilt
LB Larry Nixon (from North Texas),LB,SEC,Power 5,Auburn,Larry Nixon,North Texas
LB Jalen McLeod (from Appalachian State),LB,SEC,Power 5,Auburn,Jalen McLeod,Appalachian State
LB Austin Keys (from Ole Miss),LB,SEC,Power 5,Auburn,Austin Keys,Ole Miss
QB Graham Mertz (from Wisconsin),QB,SEC,Power 5,Florida,Graham Mertz,Wisconsin
RB Cameron Carroll (from Tulane),RB,SEC,Power 5,Florida,Cameron Carroll,Tulane
OL Damieon George (from Alabama),OL,SEC,Power 5,Florida,Damieon George,Alabama
OL Micah Mazzccua (from Baylor),OL,SEC,Power 5,Florida,Micah Mazzccua,Baylor
OL Lyndell Hudson (from FIU),OL,SEC,Power 5,Florida,Lyndell Hudson,FIU
DL Caleb Banks (from Louisville),DL,SEC,Power 5,Florida,Caleb Banks,Louisville
DL Cam'Ron Jackson (from Memphis),DL,SEC,Power 5,Florida,Cam'Ron Jackson,Memphis
LB Teradja Mitchell (from Ohio State),LB,SEC,Power 5,Florida,Teradja Mitchell,Ohio State
LB Mannie Nunnery (from Houston),LB,SEC,Power 5,Florida,Mannie Nunnery,Houston
LB Deuce Spurlock (from Michigan),LB,SEC,Power 5,Florida,Deuce Spurlock,Michigan
S R.J. Moten (from Michigan),S ,SEC,Power 5,Florida,R.J. Moten,Michigan
RB Len'Neth Whitehead (from Tennessee),RB,SEC,Power 5,Georgia,Len'Neth Whitehead,Tennessee
WR Dominic Lovett (from Missouri),WR,SEC,Power 5,Georgia,Dominic Lovett,Missouri
WR RaRa Thomas (from Mississippi State),WR,SEC,Power 5,Georgia,RaRa Thomas,Mississippi State
QB Devin Leary (from NC State),QB,SEC,Power 5,Kentucky,Devin Leary,NC State
RB Ray Davis (from Vanderbilt),RB,SEC,Power 5,Kentucky,Ray Davis,Vanderbilt
RB Demie Sumo-Karngbaye (from NC State),RB,SEC,Power 5,Kentucky,Demie Sumo-Karngbaye,NC State
OL Tanner Bowles (from Alabama),OL,SEC,Power 5,Kentucky,Tanner Bowles,Alabama
OL Marques Cox (from Northern Illinois),OL,SEC,Power 5,Kentucky,Marques Cox,Northern Illinois
OL Courtland Ford (from USC),OL,SEC,Power 5,Kentucky,Courtland Ford,USC
OL Ben Christman (from Ohio State),OL,SEC,Power 5,Kentucky,Ben Christman,Ohio State
OL Dylan Ray (from West Virginia),OL,SEC,Power 5,Kentucky,Dylan Ray,West Virginia
DL Keeshawn Silver (from North Carolina),DL,SEC,Power 5,Kentucky,Keeshawn Silver,North Carolina
LB Daveren Rayner (from Northern Illinois),LB,SEC,Power 5,Kentucky,Daveren Rayner,Northern Illinois
LB Jaquez Keyes (from Wake Forest),LB,SEC,Power 5,Kentucky,Jaquez Keyes,Wake Forest
CB JQ Hardaway (from Cincinnati),CB,SEC,Power 5,Kentucky,JQ Hardaway,Cincinnati
DB Jantzen Dunn (from Ohio State),DB,SEC,Power 5,Kentucky,Jantzen Dunn,Ohio State
K Alex Raynor (from Georgia Southern),K ,SEC,Power 5,Kentucky,Alex Raynor,Georgia Southern
RB Logan Diggs (from Notre Dame),RB,SEC,Power 5,LSU,Logan Diggs,Notre Dame
WR Aaron Anderson (from Alabama),WR,SEC,Power 5,LSU,Aaron Anderson,Alabama
OL Mason Lunsford (from Maryland),OL,SEC,Power 5,LSU,Mason Lunsford,Maryland
DL Paris Shand (from Arizona),DL,SEC,Power 5,LSU,Paris Shand,Arizona
DL Jalen Lee (from Florida),DL,SEC,Power 5,LSU,Jalen Lee,Florida
DL Jordan Jefferson (from West Virginia),DL,SEC,Power 5,LSU,Jordan Jefferson,West Virginia
DL Bradyn Swinson (from Oregon),DL,SEC,Power 5,LSU,Bradyn Swinson,Oregon
DL/LB Ovie Oghoufo (from Texas),DL,SEC,Power 5,LSU,LB Ovie Oghoufo,Texas
LB Omar Speights (from Oregon State),LB,SEC,Power 5,LSU,Omar Speights,Oregon State
CB Denver Harris (from Texas A&M),CB,SEC,Power 5,LSU,Denver Harris,Texas A&M
DB Duce Chestnut (from Syracuse),DB,SEC,Power 5,LSU,Duce Chestnut,Syracuse
DB Andre Sam (from Marshall),DB,SEC,Power 5,LSU,Andre Sam,Marshall
DB JK Johnson (from Ohio State),DB,SEC,Power 5,LSU,JK Johnson,Ohio State
DB A'Zyrian Alexander (from Southeastern Louisiana),DB,SEC,Power 5,LSU,A'Zyrian Alexander,Southeastern Louisiana
QB Walker Howard (from LSU),QB,SEC,Power 5,Ole Miss,Walker Howard,LSU
QB Spencer Sanders (from Oklahoma State),QB,SEC,Power 5,Ole Miss,Spencer Sanders,Oklahoma State
RB Jamious Griffin (from Oregon State),RB,SEC,Power 5,Ole Miss,Jamious Griffin,Oregon State
WR Tre Harris (from Louisiana Tech),WR,SEC,Power 5,Ole Miss,Tre Harris,Louisiana Tech
WR Zakhari Franklin (from UTSA),WR,SEC,Power 5,Ole Miss,Zakhari Franklin,UTSA
TE Caden Prieskorn (from Memphis),TE,SEC,Power 5,Ole Miss,Caden Prieskorn,Memphis
OL Quincy McGee (from UAB),OL,SEC,Power 5,Ole Miss,Quincy McGee,UAB
OL Victor Curne (from Washington),OL,SEC,Power 5,Ole Miss,Victor Curne,Washington
DL Joshua Harris (from NC State),DL,SEC,Power 5,Ole Miss,Joshua Harris,NC State
DL Isaac Ukwu (from James Madison),DL,SEC,Power 5,Ole Miss,Isaac Ukwu,James Madison
DL Akelo Stone (from Georgia Tech),DL,SEC,Power 5,Ole Miss,Akelo Stone,Georgia Tech
DL Stephon Wynn (from Nebraska),DL,SEC,Power 5,Ole Miss,Stephon Wynn,Nebraska
LB Monty Montgomery (from Louisville),LB,SEC,Power 5,Ole Miss,Monty Montgomery,Louisville
LB Jeremiah Jean-Baptiste (from UCF),LB,SEC,Power 5,Ole Miss,Jeremiah Jean-Baptiste,UCF
LB T.J. Dudley (from Clemson),LB,SEC,Power 5,Ole Miss,T.J. Dudley,Clemson
"DB John Saunders (from Miami, Ohio)",DB,SEC,Power 5,Ole Miss,John Saunders,"Miami, Ohio"
DB Zamari Walton (from Georgia Tech),DB,SEC,Power 5,Ole Miss,Zamari Walton,Georgia Tech
DB DeShawn Gaddie (from North Texas),DB,SEC,Power 5,Ole Miss,DeShawn Gaddie,North Texas
DB Daijahn Anthony (from Liberty),DB,SEC,Power 5,Ole Miss,Daijahn Anthony,Liberty
DB Teja Young (from FAU),DB,SEC,Power 5,Ole Miss,Teja Young,FAU
DB Chris Graves (from Miami),DB,SEC,Power 5,Ole Miss,Chris Graves,Miami
DB Jadon Canady (from Tulane),DB,SEC,Power 5,Ole Miss,Jadon Canady,Tulane
K Caden Davis (from Texas A&M),K ,SEC,Power 5,Ole Miss,Caden Davis,Texas A&M
QB Mike Wright (from Vanderbilt),QB,SEC,Power 5,Mississippi State,Mike Wright,Vanderbilt
RB Keyvone Lee (from Penn State),RB,SEC,Power 5,Mississippi State,Keyvone Lee,Penn State
WR Freddie Roberson (from Eastern Washington),WR,SEC,Power 5,Mississippi State,Freddie Roberson,Eastern Washington
TE Ryland Goede (from Georgia),TE,SEC,Power 5,Mississippi State,Ryland Goede,Georgia
TE Seydou Traore (from Arkansas State - needs waiver to play in '23),TE,SEC,Power 5,Mississippi State,Seydou Traore,Arkansas State
TE Geor'Quarius Spivey (from TCU),TE,SEC,Power 5,Mississippi State,Geor'Quarius Spivey,TCU
CB Raydarious Jones (from LSU),CB,SEC,Power 5,Mississippi State,Raydarious Jones,LSU
DB Khamauri Rogers (from Miami),DB,SEC,Power 5,Mississippi State,Khamauri Rogers,Miami
DB Christopher Keys (from Indiana),DB,SEC,Power 5,Mississippi State,Christopher Keys,Indiana
DB Jamari Brown (from Purdue),DB,SEC,Power 5,Mississippi State,Jamari Brown,Purdue
DB Kobi Albert (from Kentucky),DB,SEC,Power 5,Mississippi State,Kobi Albert,Kentucky
K Nicholas Barr-Mira (from UCLA),K ,SEC,Power 5,Mississippi State,Nicholas Barr-Mira,UCLA
K Ethan Chang (from William & Mary),K ,SEC,Power 5,Mississippi State,Ethan Chang,William & Mary
P Andrew Osteen (from UCF),P ,SEC,Power 5,Mississippi State,Andrew Osteen,UCF
QB Jake Garcia (from Miami),QB,SEC,Power 5,Missouri,Jake Garcia,Miami
WR Theo Wease (from Oklahoma),WR,SEC,Power 5,Missouri,Theo Wease,Oklahoma
WR Dannis Jackson (from Ole Miss),WR,SEC,Power 5,Missouri,Dannis Jackson,Ole Miss
OL Marcellus Johnson (from Eastern Michigan),OL,SEC,Power 5,Missouri,Marcellus Johnson,Eastern Michigan
OL Cam'Ron Johnson (from Houston),OL,SEC,Power 5,Missouri,Cam'Ron Johnson,Houston
DL Austin Firestone (from Northwestern),DL,SEC,Power 5,Missouri,Austin Firestone,Northwestern
DL Nyles Gaddy (from Jackson State),DL,SEC,Power 5,Missouri,Nyles Gaddy,Jackson State
DB Tre'Vez Johnson (from Florida),DB,SEC,Power 5,Missouri,Tre'Vez Johnson,Florida
DB Sidney Williams (from Florida State),DB,SEC,Power 5,Missouri,Sidney Williams,Florida State
P Riley Williams (from Towson),P ,SEC,Power 5,Missouri,Riley Williams,Towson
RB Mario Anderson (from Newberry),RB,SEC,Power 5,South Carolina,Mario Anderson,Newberry
WR Eddie Lewis (from Memphis),WR,SEC,Power 5,South Carolina,Eddie Lewis,Memphis
WR/DB DeAngelo Gibbs (from Tennessee),WR,SEC,Power 5,South Carolina,DB DeAngelo Gibbs,Tennessee
TE Nick Elksnis (from Florida),TE,SEC,Power 5,South Carolina,Nick Elksnis,Florida
TE Trey Knox (from Arkansas),TE,SEC,Power 5,South Carolina,Trey Knox,Arkansas
TE Joshua Simon (from Western Kentucky),TE,SEC,Power 5,South Carolina,Joshua Simon,Western Kentucky
OL Nick Gargiulo (from Yale),OL,SEC,Power 5,South Carolina,Nick Gargiulo,Yale
OL Jaxon Hughes (from Charlotte),OL,SEC,Power 5,South Carolina,Jaxon Hughes,Charlotte
OL Nigajuan Mansell (from Mercer),OL,SEC,Power 5,South Carolina,Nigajuan Mansell,Mercer
OL Sidney Fugar (from Western Illinois),OL,SEC,Power 5,South Carolina,Sidney Fugar,Western Illinois
DL Jatius Geer (from Syracuse),DL,SEC,Power 5,South Carolina,Jatius Geer,Syracuse
DL Drew Tuazama (from UAB),DL,SEC,Power 5,South Carolina,Drew Tuazama,UAB
LB Jaron Willis (from Ole Miss),LB,SEC,Power 5,South Carolina,Jaron Willis,Ole Miss
WR Dont'e Thornton (from Oregon),WR,SEC,Power 5,Tennessee,Dont'e Thornton,Oregon
TE McCallan Castles (from Cal Poly),TE,SEC,Power 5,Tennessee,McCallan Castles,Cal Poly
OL Andrej Karic (from Texas),OL,SEC,Power 5,Tennessee,Andrej Karic,Texas
OL John Campbell (from Miami),OL,SEC,Power 5,Tennessee,John Campbell,Miami
DL Omarr Norman-Lott (from Arizona State),DL,SEC,Power 5,Tennessee,Omarr Norman-Lott,Arizona State
LB Keenan Pili (from BYU),LB,SEC,Power 5,Tennessee,Keenan Pili,BYU
LB Caleb Williams (from Liberty),LB,SEC,Power 5,Tennessee,Caleb Williams,Liberty
DB Gabe Jeudy-Lally (from BYU),DB,SEC,Power 5,Tennessee,Gabe Jeudy-Lally,BYU
K Charles Campbell (from Indiana),K ,SEC,Power 5,Tennessee,Charles Campbell,Indiana
QB Jaylen Henderson (from Fresno State),QB,SEC,Power 5,Texas A&M,Jaylen Henderson,Fresno State
RB Preston Landis (from North Texas),RB,SEC,Power 5,Texas A&M,Preston Landis,North Texas
RB David Bailey (from Colorado State),RB,SEC,Power 5,Texas A&M,David Bailey,Colorado State
FB Jerry Johnson (from Rice),FB,SEC,Power 5,Texas A&M,Jerry Johnson,Rice
WR Jordan Anthony (from Kentucky),WR,SEC,Power 5,Texas A&M,Jordan Anthony,Kentucky
WR Jahdae Walker (from Grand Valley State),WR,SEC,Power 5,Texas A&M,Jahdae Walker,Grand Valley State
OL Derek Ferraro (from Richmond),OL,SEC,Power 5,Texas A&M,Derek Ferraro,Richmond
OL Finn Dirstine (from Boston College),OL,SEC,Power 5,Texas A&M,Finn Dirstine,Boston College
LB Jurriente Davis (from Jackson State),LB,SEC,Power 5,Texas A&M,Jurriente Davis,Jackson State
CB Tony Grimes (from North Carolina),CB,SEC,Power 5,Texas A&M,Tony Grimes,North Carolina
S Sam McCall (from Florida State),S ,SEC,Power 5,Texas A&M,Sam McCall,Florida State
DB Josh DeBerry (from Boston College),DB,SEC,Power 5,Texas A&M,Josh DeBerry,Boston College
WR Shawn Naim (from Akron),WR,SEC,Power 5,Vanderbilt,Shawn Naim,Akron
TE Chris Boyle (from Brown),TE,SEC,Power 5,Vanderbilt,Chris Boyle,Brown
DL Aeneas DiCosmo (from Stanford),DL,SEC,Power 5,Vanderbilt,Aeneas DiCosmo,Stanford
DL Jacob Katona (from Stanford),DL,SEC,Power 5,Vanderbilt,Jacob Katona,Stanford
LB Prince Kollie (from Notre Dame),LB,SEC,Power 5,Vanderbilt,Prince Kollie,Notre Dame
LB Carson Casteel (from Michigan State),LB,SEC,Power 5,Vanderbilt,Carson Casteel,Michigan State
K Jacob Borcila (from Kansas),K ,SEC,Power 5,Vanderbilt,Jacob Borcila,Kansas
QB Emory Jones (from Arizona State),QB,American Athletic Conference,Non Power 5,Cincinnati,Emory Jones,Arizona State
WR Keyshawn Helton (from Florida State),WR,American Athletic Conference,Non Power 5,Cincinnati,Keyshawn Helton,Florida State
WR Donovan Ollie (from Washington State),WR,American Athletic Conference,Non Power 5,Cincinnati,Donovan Ollie,Washington State
WR Dee Wiggins (from Louisville),WR,American Athletic Conference,Non Power 5,Cincinnati,Dee Wiggins,Louisville
WR Aaron Turner (from UConn),WR,American Athletic Conference,Non Power 5,Cincinnati,Aaron Turner,UConn
WR Xzavier Henderson (from Florida),WR,American Athletic Conference,Non Power 5,Cincinnati,Xzavier Henderson,Florida
WR Braden Smith (from Louisville),WR,American Athletic Conference,Non Power 5,Cincinnati,Braden Smith,Louisville
WR Sterling Berkhalter (from North Carolina A&T),WR,American Athletic Conference,Non Power 5,Cincinnati,Sterling Berkhalter,North Carolina A&T
TE Joey Beljan (from Western Kentucky),TE,American Athletic Conference,Non Power 5,Cincinnati,Joey Beljan,Western Kentucky
OL Luke Kandra (from Louisville),OL,American Athletic Conference,Non Power 5,Cincinnati,Luke Kandra,Louisville
OL Phillip Wilder (from Southeast Missouri State),OL,American Athletic Conference,Non Power 5,Cincinnati,Phillip Wilder,Southeast Missouri State
OL Deondre Buford (from Kentucky),OL,American Athletic Conference,Non Power 5,Cincinnati,Deondre Buford,Kentucky
OL Trevor Radosevich (from Penn),OL,American Athletic Conference,Non Power 5,Cincinnati,Trevor Radosevich,Penn
DL Kyree Moyston (from Virginia Tech),DL,American Athletic Conference,Non Power 5,Cincinnati,Kyree Moyston,Virginia Tech
DL Jalen Hunt (from Michigan State),DL,American Athletic Conference,Non Power 5,Cincinnati,Jalen Hunt,Michigan State
DL Daniel Grzesiak (from Utah State),DL,American Athletic Conference,Non Power 5,Cincinnati,Daniel Grzesiak,Utah State
LB Dorian Jones (from Louisville),LB,American Athletic Conference,Non Power 5,Cincinnati,Dorian Jones,Louisville
LB Dion Hunter (from New Mexico),LB,American Athletic Conference,Non Power 5,Cincinnati,Dion Hunter,New Mexico
LB Connor Keyes (from Minnesota),LB,American Athletic Conference,Non Power 5,Cincinnati,Connor Keyes,Minnesota
DB D.J. Taylor (from Arizona State),DB,American Athletic Conference,Non Power 5,Cincinnati,D.J. Taylor,Arizona State
DB George Udo (from BYU),DB,American Athletic Conference,Non Power 5,Cincinnati,George Udo,BYU
DB Jordan Young (from Florida),DB,American Athletic Conference,Non Power 5,Cincinnati,Jordan Young,Florida
K Carter Brown (from Arizona State),K ,American Athletic Conference,Non Power 5,Cincinnati,Carter Brown,Arizona State
K Rory Bell (from Temple),K ,American Athletic Conference,Non Power 5,Cincinnati,Rory Bell,Temple
RB Gerald Green (from Georgia Southern),RB,American Athletic Conference,Non Power 5,East Carolina,Gerald Green,Georgia Southern
WR Ryan King (from Georgia Tech),WR,American Athletic Conference,Non Power 5,East Carolina,Ryan King,Georgia Tech
WR Chase Sowell (from Colorado),WR,American Athletic Conference,Non Power 5,East Carolina,Chase Sowell,Colorado
WR Kelan Robinson (from Kansas),WR,American Athletic Conference,Non Power 5,East Carolina,Kelan Robinson,Kansas
OL Owen Murphy (from Akron),OL,American Athletic Conference,Non Power 5,East Carolina,Owen Murphy,Akron
OL Ryan Beckman (from Akron),OL,American Athletic Conference,Non Power 5,East Carolina,Ryan Beckman,Akron
OL Dustyn Hall (from USF),OL,American Athletic Conference,Non Power 5,East Carolina,Dustyn Hall,USF
LB BJ Davis (from South Carolina State),LB,American Athletic Conference,Non Power 5,East Carolina,BJ Davis,South Carolina State
LB RaRa Dillworth (from North Carolina),LB,American Athletic Conference,Non Power 5,East Carolina,RaRa Dillworth,North Carolina
LB Tyquan King (from North Carolina A&T),LB,American Athletic Conference,Non Power 5,East Carolina,Tyquan King,North Carolina A&T
DB Tymir Brown (from North Carolina),DB,American Athletic Conference,Non Power 5,East Carolina,Tymir Brown,North Carolina
DB Rance Conner (from Louisville),DB,American Athletic Conference,Non Power 5,East Carolina,Rance Conner,Louisville
DB Jonathan Jones (from Campbell),DB,American Athletic Conference,Non Power 5,East Carolina,Jonathan Jones,Campbell
DB Dontavius Nash (from North Carolina),DB,American Athletic Conference,Non Power 5,East Carolina,Dontavius Nash,North Carolina
DB Omar Rogers (from Elon),DB,American Athletic Conference,Non Power 5,East Carolina,Omar Rogers,Elon
K Jerry Rice III (from VMI),K ,American Athletic Conference,Non Power 5,East Carolina,Jerry Rice III,VMI
P Archer Trafford (from Mississippi State),P ,American Athletic Conference,Non Power 5,East Carolina,rcher Trafford,Mississippi State
QB Donovan Smith (from Texas Tech),QB,American Athletic Conference,Non Power 5,Houston,Donovan Smith,Texas Tech
RB Tony Mathis (from West Virginia),RB,American Athletic Conference,Non Power 5,Houston,Tony Mathis,West Virginia
WR Joshua Cobbs (from Wyoming),WR,American Athletic Conference,Non Power 5,Houston,Joshua Cobbs,Wyoming
WR Stephon Johnson Jr. (from Oklahoma State),WR,American Athletic Conference,Non Power 5,Houston,Stephon Johnson Jr.,Oklahoma State
TE Mike O'Laughlin (from West Virginia),TE,American Athletic Conference,Non Power 5,Houston,Mike O'Laughlin,West Virginia
OL Jaylen Garth (from Texas),OL,American Athletic Conference,Non Power 5,Houston,Jaylen Garth,Texas
OL Max Banes (from Akron),OL,American Athletic Conference,Non Power 5,Houston,Max Banes,Akron
OL David Ndukwe (from Western Kentucky),OL,American Athletic Conference,Non Power 5,Houston,David Ndukwe,Western Kentucky
OL Peyton Dunn (from ULM),OL,American Athletic Conference,Non Power 5,Houston,Peyton Dunn,ULM
OL Shamar Hobdy-Lee (from FIU),OL,American Athletic Conference,Non Power 5,Houston,Shamar Hobdy-Lee,FIU
DL Brandon Mack (from Ole Miss),DL,American Athletic Conference,Non Power 5,Houston,Brandon Mack,Ole Miss
DL David Ugwoegbu (from Oklahoma),DL,American Athletic Conference,Non Power 5,Houston,David Ugwoegbu,Oklahoma
LB Aubrey Smith (from Colorado),LB,American Athletic Conference,Non Power 5,Houston,Aubrey Smith,Colorado
DB Malik Fleming (from East Carolina),DB,American Athletic Conference,Non Power 5,Houston,Malik Fleming,East Carolina
DB Latrell McCutchin (from USC),DB,American Athletic Conference,Non Power 5,Houston,Latrell McCutchin,USC
DB Isaiah Hamilton (from Texas Southern),DB,American Athletic Conference,Non Power 5,Houston,Isaiah Hamilton,Texas Southern
S A.J. Haulcy (from New Mexico),S ,American Athletic Conference,Non Power 5,Houston,.J. Haulcy,New Mexico
DB Brian George (from Texas A&M),DB,American Athletic Conference,Non Power 5,Houston,Brian George,Texas A&M
K Jack Martin (from Alabama),K ,American Athletic Conference,Non Power 5,Houston,Jack Martin,Alabama
K Cooper Hamilton (from Eastern New Mexico),K ,American Athletic Conference,Non Power 5,Houston,Cooper Hamilton,Eastern New Mexico
QB Cade Cunningham (from Marshall),QB,American Athletic Conference,Non Power 5,Memphis,Cade Cunningham,Marshall
RB Blake Watson (from Old Dominion),RB,American Athletic Conference,Non Power 5,Memphis,Blake Watson,Old Dominion
RB Ke'Travion Hargrove (from Mississippi State),RB,American Athletic Conference,Non Power 5,Memphis,Ke'Travion Hargrove,Mississippi State
WR Tauskie Dove (from Missouri),WR,American Athletic Conference,Non Power 5,Memphis,Tauskie Dove,Missouri
